{
  "$schema": "https://json-schema.org/draft/2020-12/schema",
  "$id": "https://smadp.dev/schema/1.0/profile.unverified.schema.json",
  "title": "SMADP Safety Profile — unverified-profile tier",
  "description": "Minimal schema for autopilot-bootstrapped profile stubs (evidence_level=unverified-profile). The full Safety Profile schema is in profile.schema.json and applies to docs-only or higher tiers. Stubs only carry the smallest set of fields needed for catalog navigation; richer fields (vendor, sandboxing, verification, etc.) are populated by the enrichment pipeline before the profile crosses into docs-only.",
  "type": "object",
  "required": [
    "slug",
    "name",
    "evidence_level"
  ],
  "additionalProperties": true,
  "properties": {
    "schema_version": {"enum": ["1.0", "1.1"]},
    "slug": {"type": "string", "pattern": "^[a-z0-9][a-z0-9-]{1,63}$"},
    "name": {"type": "string", "minLength": 1, "maxLength": 200},
    "evidence_level": {"const": "unverified-profile"},
    "category": {"type": "string"},
    "docs_urls": {"type": "array", "items": {"type": "string"}},
    "evidence_refs": {"type": "array", "items": {"type": "string"}},
    "capabilities": {"type": ["object", "null"]},
    "data_classes_touched": {"type": "array"},
    "concurrency_model": {"type": ["object", "null"]},
    "composite_score": {"type": ["number", "null"]},
    "license": {"type": ["string", "null"]},
    "onexus": {"type": ["object", "null"]}
  }
}
