{
  "slug": "code-review-graph",
  "name": "code-review-graph",
  "category": "coding",
  "evidence_level": "unverified-profile",
  "docs_urls": [
    "https://code-review-graph.com/",
    "https://github.com/tirth8205/code-review-graph"
  ],
  "evidence_refs": [
    "sha256:9a8ce89b429ad3cd980e2830bd2930436e56639aae2fba66a5d25adf3161706d",
    "sha256:8c8df191d1bf6ce07f7d961226ce6b71eaabdb520c0b7a64764d879300504f4c"
  ],
  "capabilities": null,
  "data_classes_touched": [],
  "concurrency_model": null,
  "composite_score": 0.3836,
  "license": "MIT",
  "onexus": {
    "source_github": "tirth8205/code-review-graph",
    "author_handle": "tirth8205",
    "tags": [
      "ai-coding",
      "claude",
      "claude-code",
      "code-review",
      "graphrag",
      "incremental",
      "knowledge-graph",
      "llm",
      "mcp",
      "python"
    ],
    "runnable": false
  }
}
