{
  "capabilities": null,
  "category": "video-generation",
  "composite_score": 0.5403,
  "concurrency_model": null,
  "data_classes_touched": [],
  "docs_urls": [
    "https://aivideo.hunyuan.tencent.com/",
    "https://github.com/Tencent-Hunyuan/HunyuanVideo"
  ],
  "evidence_level": "unverified-profile",
  "evidence_refs": [],
  "license": "NOASSERTION",
  "name": "HunyuanVideo",
  "onexus": {
    "author_handle": "Tencent-Hunyuan",
    "runnable": false,
    "source_github": "Tencent-Hunyuan/HunyuanVideo",
    "tags": [
      "diffusion-models",
      "diffusion-transformer",
      "video-generation"
    ]
  },
  "slug": "hunyuanvideo"
}
