{
  "slug": "llm-action",
  "name": "llm-action",
  "category": "coding",
  "evidence_level": "unverified-profile",
  "docs_urls": [
    "https://www.zhihu.com/column/c_1456193767213043713",
    "https://github.com/liguodongiot/llm-action"
  ],
  "evidence_refs": [
    "sha256:af4ecdb36255ac9f3f511acd34a4f7772cfba774d523a7fa6fea904bbfb4a938",
    "sha256:958faa7d5251aa75fdde2ea458803040bf304683d002b31b7ad4c085a8990cde"
  ],
  "capabilities": null,
  "data_classes_touched": [],
  "concurrency_model": null,
  "composite_score": 0.4322,
  "license": "Apache-2.0",
  "onexus": {
    "source_github": "liguodongiot/llm-action",
    "author_handle": "liguodongiot",
    "tags": [
      "llm",
      "llm-inference",
      "llm-serving",
      "llm-training",
      "llmops"
    ],
    "runnable": false
  }
}
