{
  "slug": "numina-lean-agent",
  "name": "numina-lean-agent",
  "category": "reasoning-math",
  "evidence_level": "unverified-profile",
  "docs_urls": [
    "https://github.com/project-numina/numina-lean-agent"
  ],
  "evidence_refs": [
    "sha256:04f6ff8fee8ead8ada9a8c30c47a0b39f446bb9bcb65b75647ebd8730b7312d2"
  ],
  "capabilities": null,
  "data_classes_touched": [],
  "concurrency_model": null,
  "composite_score": 0.2962,
  "license": "Unknown",
  "onexus": {
    "source_github": "project-numina/numina-lean-agent",
    "author_handle": "project-numina",
    "tags": [],
    "runnable": false
  }
}
