{
  "slug": "llmagentpapers",
  "name": "LLMAgentPapers",
  "category": "scientific-research",
  "evidence_level": "unverified-profile",
  "docs_urls": [
    "https://github.com/zjunlp/LLMAgentPapers"
  ],
  "evidence_refs": [
    "sha256:c25da9951cad9faa389ba06c2c0a4acb819db65d508e62c16044ba45e9337286"
  ],
  "capabilities": null,
  "data_classes_touched": [],
  "concurrency_model": null,
  "composite_score": 0.6643,
  "license": "Unknown",
  "onexus": {
    "source_github": "zjunlp/LLMAgentPapers",
    "author_handle": "zjunlp",
    "tags": [
      "agent",
      "agents",
      "awsome-list",
      "environment",
      "in-context-learning",
      "instruction-following",
      "interactive",
      "large-language-models",
      "llm",
      "multiagent-systems"
    ],
    "runnable": false
  }
}
