{
  "capabilities": null,
  "category": "multi-agent-orchestration",
  "composite_score": 0.3293,
  "concurrency_model": null,
  "data_classes_touched": [],
  "docs_urls": [
    "https://agents.flex42.dev/",
    "https://github.com/chmod777john/swarm-ide"
  ],
  "evidence_level": "unverified-profile",
  "evidence_refs": [],
  "license": "Unknown",
  "name": "swarm-ide",
  "onexus": {
    "author_handle": "chmod777john",
    "runnable": true,
    "source_github": "chmod777john/swarm-ide",
    "tags": []
  },
  "slug": "swarm-ide"
}
