{
  "slug": "text2cypher-react-agent-example",
  "name": "text2cypher-react-agent-example",
  "category": "web-dev",
  "evidence_level": "unverified-profile",
  "docs_urls": [
    "https://github.com/neo4j-field/text2cypher-react-agent-example"
  ],
  "evidence_refs": [
    "sha256:3f7b11e7590de4f9f40ea39036d3d4fae0136a4d7b6a35a2837ff3c7767ebb40"
  ],
  "capabilities": null,
  "data_classes_touched": [],
  "concurrency_model": null,
  "composite_score": 0.3064,
  "license": "Apache-2.0",
  "onexus": {
    "source_github": "neo4j-field/text2cypher-react-agent-example",
    "author_handle": "neo4j-field",
    "tags": [],
    "runnable": false
  }
}
