{
  "capabilities": null,
  "category": "customer-support",
  "composite_score": 0.3133,
  "concurrency_model": null,
  "data_classes_touched": [],
  "docs_urls": [
    "https://github.com/aadimangla/Customer-Service-Bot"
  ],
  "evidence_level": "unverified-profile",
  "evidence_refs": [],
  "license": "MIT",
  "name": "Customer-Service-Bot",
  "onexus": {
    "author_handle": "aadimangla",
    "runnable": false,
    "source_github": "aadimangla/Customer-Service-Bot",
    "tags": []
  },
  "slug": "customer-service-bot"
}
