{
  "slug": "hookprobe",
  "name": "hookprobe",
  "category": "security-pentesting",
  "evidence_level": "unverified-profile",
  "docs_urls": [
    "https://hookprobe.com/",
    "https://github.com/hookprobe/hookprobe"
  ],
  "evidence_refs": [
    "sha256:9a957f8e34eb2437f604893e6d2cbbde781980aa7f256a00b49771ad9390bad0",
    "sha256:818e8b15812d2d7cca46d82ef9b9ac675785b04d8815f3082b4478089aa4c45d"
  ],
  "capabilities": null,
  "data_classes_touched": [],
  "concurrency_model": null,
  "composite_score": 0.3991,
  "license": "NOASSERTION",
  "onexus": {
    "source_github": "hookprobe/hookprobe",
    "author_handle": "hookprobe",
    "tags": [
      "ai-security",
      "cybersecurity",
      "ebpf",
      "edge-computing",
      "ids",
      "intrusion-detection",
      "iot-security",
      "ips",
      "machine-learning",
      "network-security"
    ],
    "runnable": false
  }
}
