{
  "slug": "comfyui-workflows",
  "name": "comfyui-workflows",
  "category": "image-generation",
  "evidence_level": "unverified-profile",
  "docs_urls": [
    "https://github.com/roblaughter/comfyui-workflows"
  ],
  "evidence_refs": [
    "sha256:c56533b55e79d5fc131a606c1c5823963d2aa9873c2a08da6502760eb42fc621"
  ],
  "capabilities": null,
  "data_classes_touched": [],
  "concurrency_model": null,
  "composite_score": 0.2816,
  "license": "Unknown",
  "onexus": {
    "source_github": "roblaughter/comfyui-workflows",
    "author_handle": "roblaughter",
    "tags": [
      "comfyui",
      "comfyui-nodes",
      "comfyui-workflow",
      "stable-diffusion"
    ],
    "runnable": false
  }
}
