{
  "slug": "wealtharchitect-ai",
  "name": "WealthArchitect-AI",
  "category": "financial-modeling",
  "evidence_level": "unverified-profile",
  "docs_urls": [
    "https://github.com/littleDataChamp/WealthArchitect-AI"
  ],
  "evidence_refs": [
    "sha256:a18bd33dc2eb053807dff3fcaf94083ab8bda87a7bcd4d21e5576f0ad16ee92b"
  ],
  "capabilities": null,
  "data_classes_touched": [],
  "concurrency_model": null,
  "composite_score": 0.2494,
  "license": "Unknown",
  "onexus": {
    "source_github": "littleDataChamp/WealthArchitect-AI",
    "author_handle": "littleDataChamp",
    "tags": [
      "ai",
      "enterprise-ai",
      "financial-ai",
      "flask",
      "gemini",
      "google-cloud",
      "multimodal-ai"
    ],
    "runnable": false
  }
}
