{
  "capabilities": null,
  "category": "document-processing",
  "composite_score": 0.5129,
  "concurrency_model": null,
  "data_classes_touched": [],
  "docs_urls": [
    "https://github.com/priyankavergadia/google-cloud-4-words"
  ],
  "evidence_level": "unverified-profile",
  "evidence_refs": [],
  "license": "NOASSERTION",
  "name": "google-cloud-4-words",
  "onexus": {
    "author_handle": "priyankavergadia",
    "runnable": false,
    "source_github": "priyankavergadia/google-cloud-4-words",
    "tags": []
  },
  "slug": "google-cloud-4-words"
}
