{
  "capabilities": null,
  "category": "search-rag",
  "composite_score": 0.5447,
  "concurrency_model": null,
  "data_classes_touched": [],
  "docs_urls": [
    "https://github.com/Andrew-Jang/RAGHub"
  ],
  "evidence_level": "unverified-profile",
  "evidence_refs": [],
  "license": "MIT",
  "name": "RAGHub",
  "onexus": {
    "author_handle": "Andrew-Jang",
    "runnable": false,
    "source_github": "Andrew-Jang/RAGHub",
    "tags": [
      "ai",
      "artificial-intelligence",
      "large-language-models",
      "llm",
      "machine-learning",
      "natural-language-processing",
      "nlp",
      "open-source",
      "rag",
      "retrieval-augmented-generation"
    ]
  },
  "slug": "raghub"
}
