{
  "slug": "sod-0-6b-gguf",
  "name": "SOD-0.6B-GGUF",
  "category": "reasoning-math",
  "evidence_level": "unverified-profile",
  "docs_urls": [],
  "evidence_refs": [],
  "capabilities": null,
  "data_classes_touched": [],
  "concurrency_model": null,
  "composite_score": 0.2814,
  "license": "apache-2.0",
  "onexus": {
    "source_github": null,
    "author_handle": "mradermacher",
    "tags": [
      "transformers",
      "gguf",
      "agent",
      "tool-use",
      "distillation",
      "math",
      "code",
      "reasoning",
      "en",
      "base_model:youngzhong/SOD-0.6B"
    ],
    "runnable": false
  }
}
