{
  "slug": "mnehmos-multi-agent-framework",
  "name": "mnehmos.multi-agent.framework",
  "category": "search-rag",
  "evidence_level": "unverified-profile",
  "docs_urls": [
    "https://mnehmos.github.io/mnehmos.multi-agent.framework/",
    "https://github.com/Mnehmos/mnehmos.multi-agent.framework"
  ],
  "evidence_refs": [
    "sha256:66ec8ee005c6d9f0400ecd3eefde6e0e40b071a6d123e60eff58a46df43db238",
    "sha256:eb039cb2817c9243fa7707d98e452c2f13808471bc470eecf59f48999ae213d4"
  ],
  "capabilities": null,
  "data_classes_touched": [],
  "concurrency_model": null,
  "composite_score": 0.2982,
  "license": "MIT",
  "onexus": {
    "source_github": "Mnehmos/mnehmos.multi-agent.framework",
    "author_handle": "Mnehmos",
    "tags": [],
    "runnable": false
  }
}
