{
  "capabilities": null,
  "category": "web-dev",
  "composite_score": 0.3024,
  "concurrency_model": null,
  "data_classes_touched": [],
  "docs_urls": [
    "https://github.com/xuzeyu91/BlogAgent"
  ],
  "evidence_level": "unverified-profile",
  "evidence_refs": [],
  "license": "Unknown",
  "name": "BlogAgent",
  "onexus": {
    "author_handle": "xuzeyu91",
    "runnable": false,
    "source_github": "xuzeyu91/BlogAgent",
    "tags": []
  },
  "slug": "blogagent"
}
