{
  "slug": "azure-pipeline-agents",
  "name": "azure-pipeline-agents",
  "category": "devops-sre",
  "evidence_level": "unverified-profile",
  "docs_urls": [
    "https://github.com/geekzter/azure-pipeline-agents"
  ],
  "evidence_refs": [
    "sha256:0e13825b76f802da93530966306ccdc1e03501535d4b9dbbc4bab056726a2328"
  ],
  "capabilities": null,
  "data_classes_touched": [],
  "concurrency_model": null,
  "composite_score": 0.3019,
  "license": "MIT",
  "onexus": {
    "source_github": "geekzter/azure-pipeline-agents",
    "author_handle": "geekzter",
    "tags": [
      "azure",
      "azure-bastion",
      "azure-devops",
      "azure-devops-agent",
      "azure-devops-pipelines",
      "azure-firewall",
      "azure-pipeline",
      "azure-pipelines-agent",
      "azure-pipelines-yaml",
      "azure-virtual-networks"
    ],
    "runnable": false
  }
}
