{
  "slug": "pengym",
  "name": "PenGym",
  "category": "security-pentesting",
  "evidence_level": "unverified-profile",
  "docs_urls": [
    "https://github.com/cyb3rlab/PenGym"
  ],
  "evidence_refs": [
    "sha256:2a0a0eb0d78ec865f6f453c01ec53f0750bd013b90250a6d206b94893579211e"
  ],
  "capabilities": null,
  "data_classes_touched": [],
  "concurrency_model": null,
  "composite_score": 0.2771,
  "license": "BSD-3-Clause",
  "onexus": {
    "source_github": "cyb3rlab/PenGym",
    "author_handle": "cyb3rlab",
    "tags": [],
    "runnable": false
  }
}
