{
  "slug": "agent-implementation",
  "name": "agent-implementation",
  "category": "web-dev",
  "evidence_level": "unverified-profile",
  "docs_urls": [
    "https://github.com/mattambrogi/agent-implementation"
  ],
  "evidence_refs": [
    "sha256:fc18aa6c1056d4d699d3ea924d52b88c4512176644d52224e9b52a6fa073b69f"
  ],
  "capabilities": null,
  "data_classes_touched": [],
  "concurrency_model": null,
  "composite_score": 0.2622,
  "license": "Unknown",
  "onexus": {
    "source_github": "mattambrogi/agent-implementation",
    "author_handle": "mattambrogi",
    "tags": [],
    "runnable": false
  }
}
