{
  "capabilities": null,
  "category": "data-engineering",
  "composite_score": 0.5444,
  "concurrency_model": null,
  "data_classes_touched": [],
  "docs_urls": [
    "https://github.com/dbt-labs/ade-bench"
  ],
  "evidence_level": "unverified-profile",
  "evidence_refs": [],
  "license": "Apache-2.0",
  "name": "ade-bench",
  "onexus": {
    "author_handle": "dbt-labs",
    "runnable": false,
    "source_github": "dbt-labs/ade-bench",
    "tags": []
  },
  "slug": "ade-bench"
}
