{
  "slug": "remote-chat-with-desktop-agent",
  "name": "Remote-Chat-With-Desktop-Agent",
  "category": "desktop-os-automation",
  "evidence_level": "unverified-profile",
  "docs_urls": [
    "https://github.com/zkenjiz/Remote-Chat-With-Desktop-Agent"
  ],
  "evidence_refs": [
    "sha256:372829b6fe2fd945afba1a0d511a25985a82058966a6c8ef427b88d57d62936c"
  ],
  "capabilities": null,
  "data_classes_touched": [],
  "concurrency_model": null,
  "composite_score": 0.2329,
  "license": "Unknown",
  "onexus": {
    "source_github": "zkenjiz/Remote-Chat-With-Desktop-Agent",
    "author_handle": "zkenjiz",
    "tags": [],
    "runnable": false
  }
}
