{
  "slug": "scikit-gmsh",
  "name": "scikit-gmsh",
  "category": "scientific-research",
  "evidence_level": "unverified-profile",
  "docs_urls": [
    "https://scikit-gmsh.readthedocs.io/en/latest",
    "https://github.com/pyvista/scikit-gmsh"
  ],
  "evidence_refs": [
    "sha256:e361e81a606b3b8bd190afd11fe5834d2b81eb09b13995d7ef3d56efeed4647b",
    "sha256:0f3db047d7a5e89bb6e9d017e00dcd0f0e36cafcc3c65f6ba547e4615d100a35"
  ],
  "capabilities": null,
  "data_classes_touched": [],
  "concurrency_model": null,
  "composite_score": 0.5534,
  "license": "GPL-3.0",
  "onexus": {
    "source_github": "pyvista/scikit-gmsh",
    "author_handle": "pyvista",
    "tags": [
      "3d",
      "engineering",
      "fem",
      "finite-element-analysis",
      "gmsh",
      "hacktoberfest",
      "mathematics",
      "mesh-generation",
      "mesh-processing",
      "meshing"
    ],
    "runnable": false
  }
}
