{
  "slug": "sandyaa",
  "name": "sandyaa",
  "category": "security-pentesting",
  "evidence_level": "unverified-profile",
  "docs_urls": [
    "https://github.com/securelayer7/sandyaa"
  ],
  "evidence_refs": [
    "sha256:b4879d6ad2ee9a3cc32b0c38b78e26aa1ea3f9c41acd3a6b4d985cf1334e658c"
  ],
  "capabilities": null,
  "data_classes_touched": [],
  "concurrency_model": null,
  "composite_score": 0.4443,
  "license": "MIT",
  "onexus": {
    "source_github": "securelayer7/sandyaa",
    "author_handle": "securelayer7",
    "tags": [],
    "runnable": false
  }
}
