{
  "capabilities": null,
  "category": "coding",
  "composite_score": 0.2348,
  "concurrency_model": null,
  "data_classes_touched": [],
  "docs_urls": [
    "https://github.com/lawrencewzen/hero-coding"
  ],
  "evidence_level": "unverified-profile",
  "evidence_refs": [],
  "license": "Unknown",
  "name": "hero-coding",
  "onexus": {
    "author_handle": "lawrencewzen",
    "runnable": false,
    "source_github": "lawrencewzen/hero-coding",
    "tags": []
  },
  "slug": "hero-coding"
}
